{
  "$schema": "https://json-schema.org/draft/2020-12/schema",
  "$id": "https://nuxt.jp/schemas/management-layout-source-lock.json",
  "type": "object",
  "additionalProperties": false,
  "required": ["schemaVersion", "checkedAt", "reviewPolicy", "sources"],
  "properties": {
    "$schema": { "type": "string" },
    "schemaVersion": { "const": 1 },
    "checkedAt": { "type": "string", "format": "date" },
    "reviewPolicy": { "const": "review-required" },
    "sources": {
      "type": "array", "minItems": 1,
      "items": { "$ref": "#/$defs/source" }
    }
  },
  "$defs": {
    "source": {
      "type": "object", "additionalProperties": false,
      "required": ["id", "title", "authority", "url", "checkedAt", "license", "status", "reviewRequired", "probes"],
      "properties": {
        "id": { "type": "string", "pattern": "^[a-z0-9-]+$" },
        "title": { "type": "string", "minLength": 1 },
        "authority": { "type": "string", "minLength": 1 },
        "url": { "type": "string", "format": "uri" },
        "checkedAt": { "type": "string", "format": "date" },
        "publishedAt": { "type": "string", "format": "date" },
        "observedVersion": { "type": "string" },
        "license": { "type": "string", "minLength": 1 },
        "status": { "enum": ["current", "delegated", "reference-only"] },
        "reviewRequired": { "const": true },
        "notes": { "type": "string" },
        "probes": {
          "type": "array", "minItems": 1,
          "items": { "$ref": "#/$defs/probe" }
        }
      }
    },
    "probe": {
      "type": "object", "additionalProperties": false,
      "required": ["type", "url", "expected"],
      "properties": {
        "type": { "const": "contains-text" },
        "url": { "type": "string", "format": "uri" },
        "expected": { "type": "string", "minLength": 1, "maxLength": 256 }
      }
    }
  }
}
